{
  "assessment": {
    "ai": {
      "candidate_finding_count": null,
      "estimated_input_tokens": null,
      "evidence_coverage": null,
      "executed": false,
      "executive_summary": null,
      "failure_code": null,
      "failure_detail": null,
      "failure_message": null,
      "fallback_used": false,
      "included_finding_count": null,
      "input_tokens": null,
      "internal_execution_artifact": null,
      "key_risks": [],
      "limitations": [],
      "model_id": null,
      "omitted_informational_count": null,
      "output_tokens": null,
      "overall_assessment": null,
      "phases": [],
      "provider": null,
      "provider_invoked": false,
      "recommendations": [],
      "result_included": false,
      "stages_completed": [],
      "static_analysis_profile": null,
      "status": "not_requested",
      "stop_reason": null,
      "total_tokens": null
    },
    "ai_enrichment": null,
    "assessment_coverage": {
      "ai_readiness": {
        "areas": [
          {
            "area_id": "ai_readiness_capability_requested",
            "candidate_count": null,
            "claim_state": "claimed",
            "eligible_rule_count": null,
            "evaluation_state": "disabled",
            "evidence_available": null,
            "executed_rule_count": null,
            "failed_count": null,
            "limitations": [],
            "partial_count": null,
            "processed_count": null,
            "skipped_count": null,
            "support_state": "unavailable",
            "title": "AI readiness capability"
          },
          {
            "area_id": "ai_readiness_evidence_availability",
            "candidate_count": null,
            "claim_state": "claimed",
            "eligible_rule_count": null,
            "evaluation_state": "disabled",
            "evidence_available": null,
            "executed_rule_count": null,
            "failed_count": null,
            "limitations": [],
            "partial_count": null,
            "processed_count": null,
            "skipped_count": null,
            "support_state": "unavailable",
            "title": "AI readiness evidence"
          },
          {
            "area_id": "ai_readiness_inventory_complete",
            "candidate_count": null,
            "claim_state": "partial",
            "eligible_rule_count": null,
            "evaluation_state": "disabled",
            "evidence_available": null,
            "executed_rule_count": null,
            "failed_count": null,
            "limitations": [
              "Area is only partially claimed by methodology."
            ],
            "partial_count": null,
            "processed_count": null,
            "skipped_count": null,
            "support_state": "unavailable",
            "title": "AI readiness inventory"
          },
          {
            "area_id": "ai_readiness_rules_enabled",
            "candidate_count": null,
            "claim_state": "claimed",
            "eligible_rule_count": null,
            "evaluation_state": "disabled",
            "evidence_available": null,
            "executed_rule_count": null,
            "failed_count": null,
            "limitations": [],
            "partial_count": null,
            "processed_count": null,
            "skipped_count": null,
            "support_state": "unavailable",
            "title": "AI readiness rules"
          }
        ],
        "derivation_status": "unavailable",
        "limitations": [
          "One or more methodology areas are only partially claimed.",
          "Repository observation coverage does not imply live runtime, organizational, or external service coverage."
        ],
        "metrics": [
          {
            "availability": "available",
            "denominator": 4,
            "limitations": [],
            "metric_id": "assessment.area_coverage",
            "numerator": 0,
            "ratio": "0.0000"
          }
        ],
        "scope": {
          "activated": false,
          "head_id": "ai_readiness",
          "pack_id": "ai_readiness",
          "support_summary": "disabled"
        },
        "status": "disabled",
        "totals": {
          "applicable_area_count": 4,
          "candidate_count": null,
          "declared_area_count": 4,
          "eligible_rule_count": null,
          "evaluated_area_count": 0,
          "executed_rule_count": null,
          "failed_count": null,
          "inspected_candidate_count": null,
          "partially_evaluated_area_count": 0,
          "partially_processed_count": null,
          "partially_supported_area_count": 1,
          "skipped_count": null,
          "successfully_processed_count": null,
          "supported_area_count": 0,
          "unavailable_rule_count": null,
          "unevaluated_area_count": 4,
          "unsupported_area_count": 0
        }
      },
      "architecture_intelligence": {
        "areas": [
          {
            "area_id": "architecture_rules",
            "candidate_count": null,
            "claim_state": "claimed",
            "eligible_rule_count": null,
            "evaluation_state": "disabled",
            "evidence_available": null,
            "executed_rule_count": null,
            "failed_count": null,
            "limitations": [],
            "partial_count": null,
            "processed_count": null,
            "skipped_count": null,
            "support_state": "unavailable",
            "title": "Architecture rules"
          },
          {
            "area_id": "build_metadata_coverage",
            "candidate_count": null,
            "claim_state": "partial",
            "eligible_rule_count": null,
            "evaluation_state": "disabled",
            "evidence_available": null,
            "executed_rule_count": null,
            "failed_count": null,
            "limitations": [
              "Area is only partially claimed by methodology."
            ],
            "partial_count": null,
            "processed_count": null,
            "skipped_count": null,
            "support_state": "unavailable",
            "title": "Build metadata"
          },
          {
            "area_id": "classification_coverage",
            "candidate_count": null,
            "claim_state": "claimed",
            "eligible_rule_count": null,
            "evaluation_state": "disabled",
            "evidence_available": null,
            "executed_rule_count": null,
            "failed_count": null,
            "limitations": [],
            "partial_count": null,
            "processed_count": null,
            "skipped_count": null,
            "support_state": "unavailable",
            "title": "Unit classification"
          },
          {
            "area_id": "enterprise_context_coverage",
            "candidate_count": null,
            "claim_state": "not_claimed",
            "eligible_rule_count": null,
            "evaluation_state": "not_applicable",
            "evidence_available": null,
            "executed_rule_count": null,
            "failed_count": null,
            "limitations": [
              "Area is not claimed by the current assessment methodology."
            ],
            "partial_count": null,
            "processed_count": null,
            "skipped_count": null,
            "support_state": "unsupported",
            "title": "Enterprise context"
          },
          {
            "area_id": "extraction_coverage",
            "candidate_count": null,
            "claim_state": "claimed",
            "eligible_rule_count": null,
            "evaluation_state": "disabled",
            "evidence_available": null,
            "executed_rule_count": null,
            "failed_count": null,
            "limitations": [],
            "partial_count": null,
            "processed_count": null,
            "skipped_count": null,
            "support_state": "unavailable",
            "title": "Source extraction"
          },
          {
            "area_id": "framework_coverage",
            "candidate_count": null,
            "claim_state": "partial",
            "eligible_rule_count": null,
            "evaluation_state": "disabled",
            "evidence_available": null,
            "executed_rule_count": null,
            "failed_count": null,
            "limitations": [
              "Area is only partially claimed by methodology."
            ],
            "partial_count": null,
            "processed_count": null,
            "skipped_count": null,
            "support_state": "unavailable",
            "title": "Framework evidence"
          }
        ],
        "derivation_status": "unavailable",
        "limitations": [
          "One or more methodology areas are only partially claimed."
        ],
        "metrics": [
          {
            "availability": "available",
            "denominator": 5,
            "limitations": [],
            "metric_id": "assessment.area_coverage",
            "numerator": 0,
            "ratio": "0.0000"
          }
        ],
        "scope": {
          "activated": false,
          "head_id": "architecture_intelligence",
          "pack_id": "architecture",
          "support_summary": "disabled"
        },
        "status": "disabled",
        "totals": {
          "applicable_area_count": 5,
          "candidate_count": null,
          "declared_area_count": 6,
          "eligible_rule_count": null,
          "evaluated_area_count": 0,
          "executed_rule_count": null,
          "failed_count": null,
          "inspected_candidate_count": null,
          "partially_evaluated_area_count": 0,
          "partially_processed_count": null,
          "partially_supported_area_count": 2,
          "skipped_count": null,
          "successfully_processed_count": null,
          "supported_area_count": 0,
          "unavailable_rule_count": null,
          "unevaluated_area_count": 5,
          "unsupported_area_count": 1
        }
      },